{
  "schemaVersion": "a0.corpus-rights-record.v1",
  "recordId": "rights-self-authored-vector-v1",
  "status": "cleared",
  "rightsBasis": "in-house-original-work",
  "rightsHolderRole": "product-owner-organization",
  "reviewedAtUtc": "2026-09-18T00:00:00Z",
  "reviewerRole": "rights-reviewer",
  "approvedUses": ["calibration-design", "development-validation", "locked-holdout-evaluation", "release-confirmation"],
  "prohibitedContent": ["customer-original", "production-capture", "camera-serial-or-identity", "licensed-sdk-material"],
  "assets": [
    { "assetId": "asset-calibration-grid", "assetKind": "SelfAuthoredVectorSpec", "repositoryPath": "samples/public/corpus-contracts/vector-specs/calibration-grid.json", "externalObjectId": null, "contentSha256": "5351fb55f04db85059feb8741373b12f54b2a26305c7024564af4c016df1f323", "source": "created-in-house", "containsCustomerContent": false, "containsCameraIdentity": false, "containsLicensedSdkMaterial": false },
    { "assetId": "asset-development-seam", "assetKind": "SelfAuthoredVectorSpec", "repositoryPath": "samples/public/corpus-contracts/vector-specs/development-seam.json", "externalObjectId": null, "contentSha256": "cd280738ecd1c10346f308f3c96c0a2454756a0b14533fb38cdd11d99f62e2df", "source": "created-in-house", "containsCustomerContent": false, "containsCameraIdentity": false, "containsLicensedSdkMaterial": false },
    { "assetId": "asset-development-seam-damaged", "assetKind": "SelfAuthoredVectorSpec", "repositoryPath": "samples/public/corpus-contracts/vector-specs/development-seam-damaged.json", "externalObjectId": null, "contentSha256": "5de1a42e3f533e170acb25858398bd3f05aa8a552bcb4d7c5344fcf94ded0b87", "source": "created-in-house", "containsCustomerContent": false, "containsCameraIdentity": false, "containsLicensedSdkMaterial": false },
    { "assetId": "asset-locked-holdout-edge", "assetKind": "SelfAuthoredVectorSpec", "repositoryPath": "samples/public/corpus-contracts/vector-specs/locked-holdout-edge.json", "externalObjectId": null, "contentSha256": "61f42068842760039d3423266f2dc1a294fc65ac88b711784b7d2145f4f02955", "source": "created-in-house", "containsCustomerContent": false, "containsCameraIdentity": false, "containsLicensedSdkMaterial": false },
    { "assetId": "asset-release-layout", "assetKind": "SelfAuthoredVectorSpec", "repositoryPath": "samples/public/corpus-contracts/vector-specs/release-layout.json", "externalObjectId": null, "contentSha256": "884c0b15dbbb442ac743e4226b3c31f87a8619d90945b7bbb6609f8d09c1bfc6", "source": "created-in-house", "containsCustomerContent": false, "containsCameraIdentity": false, "containsLicensedSdkMaterial": false },
    { "assetId": "asset-pilot-chart-development", "assetKind": "SelfAuthoredVectorSpec", "repositoryPath": "samples/public/corpus-contracts/vector-specs/pilot-chart-development-v1.json", "externalObjectId": null, "contentSha256": "d9fbbd767ca9d7f879b9fac5071326b0477340a58a80131f6c448ba66e8f9f4f", "source": "created-in-house", "containsCustomerContent": false, "containsCameraIdentity": false, "containsLicensedSdkMaterial": false },
    { "assetId": "asset-pilot-chart-holdout", "assetKind": "SelfAuthoredVectorSpec", "repositoryPath": "samples/public/corpus-contracts/vector-specs/pilot-chart-holdout-v1.json", "externalObjectId": null, "contentSha256": "5ea04ffcb95886bb784484fbe6bdd5b122bdf9d8f057d332ee33c37a4ce62b5d", "source": "created-in-house", "containsCustomerContent": false, "containsCameraIdentity": false, "containsLicensedSdkMaterial": false }
  ]
}
